{
  "schemaVersion": 2,
  "code": "STD-QC-UAT",
  "name": "Kiểm thử chấp nhận người dùng",
  "category": "11_quality_assurance_testing",
  "description": "Quy trình UAT và phê duyệt nghiệp vụ.",
  "version": "1.1.0",
  "status": "active",
  "rules": [
    {
      "title": "Xây dựng kịch bản UAT từ business flow và AC đã được chốt",
      "detail": "Xây dựng kịch bản UAT từ business flow và AC đã được chốt. Bằng chứng tối thiểu: tài liệu hoặc kết quả kiểm tra thể hiện việc áp dụng, người chịu trách nhiệm và ngoại lệ nếu có.",
      "layer": "quality",
      "severity": "must",
      "example_good": "Có bằng chứng đối chiếu và kết quả rõ ràng: Xây dựng kịch bản UAT từ business flow và AC đã được chốt.",
      "example_bad": "Không có bước kiểm tra hoặc bằng chứng cho yêu cầu: Xây dựng kịch bản UAT từ business flow và AC đã được chốt.",
      "id": "R001",
      "concerns": [
        "documentation",
        "testing"
      ]
    },
    {
      "title": "Xác định người dùng nghiệp vụ chịu trách nhiệm nghiệm thu và tiêu chí hoàn thành",
      "detail": "Xác định người dùng nghiệp vụ chịu trách nhiệm nghiệm thu và tiêu chí hoàn thành. Bằng chứng tối thiểu: tài liệu hoặc kết quả kiểm tra thể hiện việc áp dụng, người chịu trách nhiệm và ngoại lệ nếu có.",
      "layer": "quality",
      "severity": "must",
      "example_good": "Có bằng chứng đối chiếu và kết quả rõ ràng: Xác định người dùng nghiệp vụ chịu trách nhiệm nghiệm thu và tiêu chí hoàn thành.",
      "example_bad": "Không có bước kiểm tra hoặc bằng chứng cho yêu cầu: Xác định người dùng nghiệp vụ chịu trách nhiệm nghiệm thu và tiêu chí hoàn thành.",
      "id": "R002",
      "concerns": [
        "documentation",
        "testing"
      ]
    },
    {
      "title": "Lưu kết quả UAT, lỗi, ngoại lệ và quyết định sign-off",
      "detail": "Lưu kết quả UAT, lỗi, ngoại lệ và quyết định sign-off. Bằng chứng tối thiểu: tài liệu hoặc kết quả kiểm tra thể hiện việc áp dụng, người chịu trách nhiệm và ngoại lệ nếu có.",
      "layer": "quality",
      "severity": "should",
      "example_good": "Có bằng chứng đối chiếu và kết quả rõ ràng: Lưu kết quả UAT, lỗi, ngoại lệ và quyết định sign-off.",
      "example_bad": "Không có bước kiểm tra hoặc bằng chứng cho yêu cầu: Lưu kết quả UAT, lỗi, ngoại lệ và quyết định sign-off.",
      "id": "R003",
      "concerns": [
        "documentation",
        "testing"
      ]
    },
    {
      "title": "Không đồng nhất kết quả UAT với việc hoàn tất toàn bộ regression hay kiểm thử kỹ thuật",
      "detail": "Không đồng nhất kết quả UAT với việc hoàn tất toàn bộ regression hay kiểm thử kỹ thuật. Bằng chứng tối thiểu: tài liệu hoặc kết quả kiểm tra thể hiện việc áp dụng, người chịu trách nhiệm và ngoại lệ nếu có.",
      "layer": "quality",
      "severity": "should",
      "example_good": "Có bằng chứng đối chiếu và kết quả rõ ràng: Không đồng nhất kết quả UAT với việc hoàn tất toàn bộ regression hay kiểm thử kỹ thuật.",
      "example_bad": "Không có bước kiểm tra hoặc bằng chứng cho yêu cầu: Không đồng nhất kết quả UAT với việc hoàn tất toàn bộ regression hay kiểm thử kỹ thuật.",
      "id": "R004",
      "concerns": [
        "documentation",
        "networking",
        "testing"
      ]
    }
  ],
  "depends_on": [
    {
      "code": "STD-BIZ",
      "dependency_type": "uses"
    },
    {
      "code": "STD-QC-AC",
      "dependency_type": "uses"
    },
    {
      "code": "STD-QC-EXEC",
      "dependency_type": "uses"
    }
  ],
  "integration_guide": [
    {
      "step": 1,
      "title": "Đánh giá phạm vi và rủi ro",
      "description": "Đối chiếu kiểm thử chấp nhận người dùng với requirement, các luồng và độ ưu tiên kiểm thử."
    },
    {
      "step": 2,
      "title": "Triển khai và thu thập bằng chứng",
      "description": "Chuẩn bị checklist, testcase hoặc automation phù hợp; chỉ định trách nhiệm và ghi lại bằng chứng."
    },
    {
      "step": 3,
      "title": "Xác nhận và cập nhật",
      "description": "Review kết quả, ghi nhận defect/ngoại lệ và đồng bộ traceability trước khi qua quality gate."
    }
  ],
  "common_issues": [
    {
      "issue": "Thiếu bằng chứng hoặc phạm vi chưa rõ",
      "cause": "Không liên kết requirement, testcase và người chịu trách nhiệm.",
      "solution": "Thiết lập liên kết, xác định phạm vi áp dụng và yêu cầu bằng chứng trước khi hoàn tất."
    }
  ],
  "applicability": {
    "scope": "all"
  },
  "dependency_policy": {
    "inheritance": "explicit_extends_only",
    "missing_required": "error",
    "conflict_resolution": "fail_on_duplicate_rule_ref"
  }
}
