{
  "schemaVersion": 2,
  "code": "CAP-PROFILE",
  "name": "Hồ sơ người dùng & Quản lý tài khoản",
  "category": "09_reusable_capabilities",
  "description": "Capability tái sử dụng chuẩn cho Hồ sơ người dùng & Quản lý tài khoản. Được chuyển từ STD-PROFILE và căn chỉnh theo STRUCTURE.txt.",
  "version": "1.1.0",
  "status": "active",
  "rules": [
    {
      "title": "Giới hạn update cho đúng subject được ủy quyền và các field được phép",
      "detail": "Yêu cầu: Giới hạn update cho đúng subject được ủy quyền và các field được phép. Phạm vi áp dụng: các thay đổi thuộc Hồ sơ người dùng & Quản lý tài khoản có tác động tới hành vi này. Tiêu chí chấp nhận: triển khai phải chứng minh được kịch bản cụ thể sau: PATCH /me chỉ sửa displayName, avatarUrl; không cho client đổi role. Xác minh bằng kiểm tra cấu hình/source, test tự động hoặc chạy thử luồng tương ứng; nếu không áp dụng phải nêu lý do trong review.",
      "layer": "service",
      "severity": "must",
      "example_good": "PATCH /me chỉ sửa displayName, avatarUrl; không cho client đổi role. Bằng chứng gồm kết quả test/review hoặc cấu hình có thể đối chiếu.",
      "example_bad": "Chỉ ghi 'Giới hạn update cho đúng subject được ủy quyền và các field được phép' trong checklist nhưng không có triển khai hoặc kiểm thử cho tình huống: pATCH /me chỉ sửa displayName, avatarUrl; không cho client đổi role.",
      "id": "R001",
      "concerns": [
        "authorization"
      ]
    },
    {
      "title": "Validation các field thay đổi và giữ nguyên giá trị hiện có của field không đổi",
      "detail": "Yêu cầu: Validation các field thay đổi và giữ nguyên giá trị hiện có của field không đổi. Phạm vi áp dụng: các thay đổi thuộc Hồ sơ người dùng & Quản lý tài khoản có tác động tới hành vi này. Tiêu chí chấp nhận: triển khai phải chứng minh được kịch bản cụ thể sau: Schema validate phone + normalize; omitted property không bị reset. Xác minh bằng kiểm tra cấu hình/source, test tự động hoặc chạy thử luồng tương ứng; nếu không áp dụng phải nêu lý do trong review.",
      "layer": "service",
      "severity": "must",
      "example_good": "Schema validate phone + normalize; omitted property không bị reset. Bằng chứng gồm kết quả test/review hoặc cấu hình có thể đối chiếu.",
      "example_bad": "Chỉ ghi 'Validation các field thay đổi và giữ nguyên giá trị hiện có của field không đổi' trong checklist nhưng không có triển khai hoặc kiểm thử cho tình huống: schema validate phone + normalize; omitted property không bị reset.",
      "id": "R002",
      "concerns": [
        "reliability"
      ]
    },
    {
      "title": "Xử lý lỗi avatar/media và response xung đột",
      "detail": "Yêu cầu: Xử lý lỗi avatar/media và response xung đột. Phạm vi áp dụng: các thay đổi thuộc Hồ sơ người dùng & Quản lý tài khoản có tác động tới hành vi này. Tiêu chí chấp nhận: triển khai phải chứng minh được kịch bản cụ thể sau: Upload avatar timeout trả retry option, 409 hiển thị conflict. Xác minh bằng kiểm tra cấu hình/source, test tự động hoặc chạy thử luồng tương ứng; nếu không áp dụng phải nêu lý do trong review.",
      "layer": "service",
      "severity": "should",
      "example_good": "Upload avatar timeout trả retry option, 409 hiển thị conflict. Bằng chứng gồm kết quả test/review hoặc cấu hình có thể đối chiếu.",
      "example_bad": "Chỉ ghi 'Xử lý lỗi avatar/media và response xung đột' trong checklist nhưng không có triển khai hoặc kiểm thử cho tình huống: upload avatar timeout trả retry option, 409 hiển thị conflict.",
      "id": "R003",
      "concerns": [
        "reliability"
      ]
    },
    {
      "title": "Ghi audit cho các thay đổi hồ sơ nhạy cảm mà không làm lộ dữ liệu riêng tư",
      "detail": "Yêu cầu: Ghi audit cho các thay đổi hồ sơ nhạy cảm mà không làm lộ dữ liệu riêng tư. Phạm vi áp dụng: các thay đổi thuộc Hồ sơ người dùng & Quản lý tài khoản có tác động tới hành vi này. Tiêu chí chấp nhận: triển khai phải chứng minh được kịch bản cụ thể sau: Đổi email phát audit event masked và yêu cầu xác thực bổ sung. Xác minh bằng kiểm tra cấu hình/source, test tự động hoặc chạy thử luồng tương ứng; nếu không áp dụng phải nêu lý do trong review.",
      "layer": "service",
      "severity": "should",
      "example_good": "Đổi email phát audit event masked và yêu cầu xác thực bổ sung. Bằng chứng gồm kết quả test/review hoặc cấu hình có thể đối chiếu.",
      "example_bad": "Chỉ ghi 'Ghi audit cho các thay đổi hồ sơ nhạy cảm mà không làm lộ dữ liệu riêng tư' trong checklist nhưng không có triển khai hoặc kiểm thử cho tình huống: đổi email phát audit event masked và yêu cầu xác thực bổ sung.",
      "id": "R004",
      "concerns": [
        "compliance",
        "privacy"
      ]
    }
  ],
  "integration_guide": [
    {
      "step": 1,
      "title": "Đánh giá phạm vi áp dụng",
      "description": "Kiểm tra nền tảng project, requirement, kiến trúc và các điều kiện áp dụng của Hồ sơ người dùng & Quản lý tài khoản; ghi nhận trường hợp loại trừ và override đã được phê duyệt."
    },
    {
      "step": 2,
      "title": "Áp dụng quy tắc",
      "description": "Đưa các quy tắc Hồ sơ người dùng & Quản lý tài khoản áp dụng vào requirement, thiết kế, triển khai và checklist review; liên kết requirement và code liên quan khi phù hợp."
    },
    {
      "step": 3,
      "title": "Xác minh tuân thủ",
      "description": "Review bằng chứng, chạy các kiểm tra tự động/thủ công liên quan, ghi nhận lỗi, ngoại lệ được phê duyệt và công việc theo dõi trước khi hoàn tất."
    }
  ],
  "common_issues": [
    {
      "issue": "Áp dụng Hồ sơ người dùng & Quản lý tài khoản không nhất quán",
      "cause": "Project profile chưa tham chiếu rõ standard/capability áp dụng hoặc chưa chỉ định owner.",
      "solution": "Tham chiếu rõ CAP-PROFILE trong project profile, chỉ định owner và kiểm tra tuân thủ trước khi phê duyệt thay đổi."
    },
    {
      "issue": "Standard dạng văn bản không thể tự động thực thi hoàn toàn",
      "cause": "Một số hành vi phụ thuộc vào quyết định thiết kế và ngữ cảnh runtime.",
      "solution": "Kết hợp lint/test tự động với review thủ công và bằng chứng chấp nhận được ghi nhận."
    }
  ],
  "features": [
    {
      "name": "Feature hồ sơ người dùng",
      "description": "Chỉnh sửa hồ sơ và ownership dữ liệu"
    }
  ],
  "user_stories": [
    {
      "title": "Sử dụng Feature hồ sơ người dùng",
      "as_a": "người dùng ứng dụng đã được xác thực và có quyền",
      "i_want": "chỉnh sửa hồ sơ và ownership dữ liệu",
      "so_that": "tôi có thể hoàn thành tác vụ mong muốn một cách an toàn và có thể dự đoán",
      "acceptance_criteria": [
        {
          "given": "người dùng đủ điều kiện truy cập Feature hồ sơ người dùng",
          "when": "người dùng thực hiện thao tác chính được hỗ trợ",
          "then": "hệ thống trả về kết quả đã được phân quyền, được validation và truyền đạt rõ trạng thái"
        },
        {
          "given": "input, permission hoặc dependency không hợp lệ",
          "when": "người dùng thực hiện thao tác",
          "then": "hệ thống chặn việc hoàn tất không an toàn và hiển thị lỗi có thể khôi phục, không chứa dữ liệu nhạy cảm"
        }
      ],
      "related_rules": [
        "Giới hạn update cho đúng subject được ủy quyền và các field được phép"
      ]
    }
  ],
  "depends_on": [
    {
      "code": "STD-FEAT",
      "dependency_type": "requires"
    },
    {
      "code": "STD-BIZ",
      "dependency_type": "requires"
    }
  ],
  "diagrams": [],
  "applicability": {
    "scope": "conditional",
    "conditions": [
      {
        "key": "features.profile",
        "operator": "eq",
        "value": true
      }
    ]
  },
  "dependency_policy": {
    "inheritance": "explicit_extends_only",
    "missing_required": "error",
    "conflict_resolution": "fail_on_duplicate_rule_ref"
  }
}
