{
  "schemaVersion": 2,
  "code": "STD-VERSIONING",
  "name": "Quản lý phiên bản, Tương thích & Ngừng hỗ trợ",
  "category": "01_governance_delivery",
  "description": "Quản lý phiên bản, Tương thích & Ngừng hỗ trợ: yêu cầu triển khai và kiểm chứng cụ thể cho STD-VERSIONING, bao gồm hợp đồng hành vi, failure mode, quality gate và ví dụ đúng/sai.",
  "version": "1.3.0",
  "status": "active",
  "rules": [
    {
      "title": "Dùng thay đổi tương thích cho API và contract",
      "detail": "Lập bảng compatibility cho response field, error code, event và client; breaking change yêu cầu migration plan và thông báo consumer.",
      "layer": "delivery",
      "severity": "must",
      "example_good": "Thêm optional field không phá client và contract test vẫn pass.",
      "example_bad": "Đổi type userId từ string sang object không versioning.",
      "id": "R001",
      "concerns": [
        "compatibility"
      ]
    },
    {
      "title": "Áp dụng version sản phẩm theo chính sách rõ ràng",
      "detail": "Xác định SemVer cho thư viện hoặc release version cho app; quy tắc major/minor/patch được tài liệu hóa và đối chiếu diff.",
      "layer": "delivery",
      "severity": "must",
      "example_good": "Bỏ public method => major version package SDK.",
      "example_bad": "Xóa method nhưng phát hành patch.",
      "id": "R002",
      "concerns": [
        "compatibility",
        "documentation",
        "release"
      ]
    },
    {
      "title": "Thiết lập thời hạn hỗ trợ và deprecation",
      "detail": "Thông báo sunset, phiên bản thay thế, thời hạn hỗ trợ và metric consumer đang dùng; chỉ tắt sau khi kiểm tra usage/approval.",
      "layer": "delivery",
      "severity": "must",
      "example_good": "Header Deprecation/Sunset và dashboard sử dụng endpoint cũ.",
      "example_bad": "Xóa endpoint ngay trong cùng release.",
      "id": "R003",
      "concerns": [
        "observability"
      ]
    },
    {
      "id": "R004",
      "title": "Kiểm thử backward và forward compatibility",
      "detail": "Contract tests kiểm cả old client/new server và retry/dữ liệu persisted qua phiên bản; xác định giới hạn hỗ trợ.",
      "example_good": "CI test mobile v1.5 với API v2.1 trong compatibility matrix.",
      "example_bad": "Chỉ test client/server latest cùng lúc.",
      "layer": "delivery",
      "severity": "should",
      "concerns": [
        "compatibility",
        "reliability",
        "testing"
      ]
    },
    {
      "id": "R005",
      "title": "Đồng bộ version schema và migration",
      "detail": "Thay đổi DB/event/file format có version hoặc migration rõ; không đặt version chỉ bằng tên file nếu consumer cần xác định.",
      "example_good": "Event payload có schemaVersion và consumer reject version không hỗ trợ.",
      "example_bad": "Consumer parse mọi payload theo cấu trúc mới.",
      "layer": "delivery",
      "severity": "should",
      "concerns": [
        "compatibility",
        "usability"
      ]
    },
    {
      "id": "R006",
      "title": "Ma trận hỗ trợ client/server/contract",
      "detail": "Duy trì matrix app version x API contract x backend; policy deprecation có telemetry và thời hạn nâng cấp.",
      "layer": "architecture",
      "severity": "must",
      "example_good": "Old mobile app vẫn gọi API hiện tại",
      "example_bad": "Assume tất cả user nâng app ngay",
      "concerns": [
        "compatibility"
      ]
    }
  ],
  "integration_guide": [
    {
      "step": 1,
      "title": "Đánh giá phạm vi áp dụng",
      "description": "Kiểm tra nền tảng project, requirement, kiến trúc và các điều kiện áp dụng của Quản lý phiên bản, Tương thích & Ngừng hỗ trợ; ghi nhận trường hợp loại trừ và override đã được phê duyệt."
    },
    {
      "step": 2,
      "title": "Áp dụng quy tắc",
      "description": "Đưa các quy tắc Quản lý phiên bản, Tương thích & Ngừng hỗ trợ áp dụng vào requirement, thiết kế, triển khai và checklist review; liên kết requirement và code liên quan khi phù hợp."
    },
    {
      "step": 3,
      "title": "Xác minh tuân thủ",
      "description": "Review bằng chứng, chạy các kiểm tra tự động/thủ công liên quan, ghi nhận lỗi, ngoại lệ được phê duyệt và công việc theo dõi trước khi hoàn tất."
    }
  ],
  "common_issues": [
    {
      "issue": "Áp dụng Quản lý phiên bản, Tương thích & Ngừng hỗ trợ không nhất quán",
      "cause": "Project profile chưa tham chiếu rõ standard/capability áp dụng hoặc chưa chỉ định owner.",
      "solution": "Tham chiếu rõ STD-VERSIONING trong project profile, chỉ định owner và kiểm tra tuân thủ trước khi phê duyệt thay đổi."
    },
    {
      "issue": "Quy tắc đã được tài liệu hóa nhưng chưa có cơ chế xác minh",
      "cause": "Chưa có test, lint, checklist, bằng chứng review hoặc kiểm tra vận hành gắn với quy tắc.",
      "solution": "Gắn từng quy tắc quan trọng với bằng chứng xác minh thực tế và ghi nhận rõ các ngoại lệ."
    }
  ],
  "depends_on": [],
  "diagrams": [],
  "applicability": {
    "scope": "all"
  },
  "dependency_policy": {
    "inheritance": "explicit_extends_only",
    "missing_required": "error",
    "conflict_resolution": "fail_on_duplicate_rule_ref"
  }
}
