{
  "schemaVersion": 2,
  "code": "STD-BE-FILE",
  "name": "Xử lý tệp & Object Storage",
  "category": "07_backend_platform",
  "description": "Xử lý tệp & Object Storage: quy định các yêu cầu triển khai và bằng chứng kiểm tra cụ thể; chỉ áp dụng khi phạm vi project liên quan.",
  "version": "1.1.0",
  "status": "active",
  "rules": [
    {
      "title": "Giới hạn và xác thực tệp phía server",
      "detail": "Giới hạn kích thước/số tệp và kiểm tra magic bytes với loại MIME cho phép; không tin extension hoặc Content-Type đầu vào. Kiểm chứng bằng test/review hoặc cấu hình triển khai theo yêu cầu này.",
      "layer": "api",
      "severity": "must",
      "example_good": "PDF được kiểm tra signature %PDF và size limit được cấu hình.",
      "example_bad": "Tin file.exe đổi tên thành .pdf.",
      "id": "R001",
      "concerns": [
        "reliability"
      ]
    },
    {
      "title": "Tên tệp và đường dẫn không do client điều khiển",
      "detail": "Lưu object với generated ID; canonicalize và chặn path traversal; tên gốc chỉ giữ metadata đã sanitize. Kiểm chứng bằng test/review hoặc cấu hình triển khai theo yêu cầu này.",
      "layer": "api",
      "severity": "must",
      "example_good": "Upload lưu key dạng UUID; download qua ID có quyền.",
      "example_bad": "Nối ../ từ request thành đường dẫn ổ đĩa.",
      "id": "R002",
      "concerns": [
        "reliability"
      ]
    },
    {
      "title": "Quét và cách ly nội dung nguy hiểm",
      "detail": "Tệp untrusted phải vào vùng quarantine, quét malware khi rủi ro yêu cầu trước khi mở truy cập cho người khác. Kiểm chứng bằng test/review hoặc cấu hình triển khai theo yêu cầu này.",
      "layer": "api",
      "severity": "should",
      "example_good": "Tệp được scan trước khi status chuyển AVAILABLE.",
      "example_bad": "Upload xong được phục vụ công khai tức thì.",
      "id": "R003",
      "concerns": [
        "reliability"
      ]
    },
    {
      "title": "Kiểm soát tải xuống và vòng đời",
      "detail": "Kiểm quyền theo object, dùng signed URL thời hạn ngắn, dọn orphan sau lỗi giao dịch theo job có idempotency. Kiểm chứng bằng test/review hoặc cấu hình triển khai theo yêu cầu này.",
      "layer": "api",
      "severity": "should",
      "example_good": "User A không thể lấy file user B bằng cách đổi ID.",
      "example_bad": "Bucket public chứa toàn bộ tài liệu cá nhân.",
      "id": "R004",
      "concerns": [
        "reliability"
      ]
    }
  ],
  "integration_guide": [
    {
      "step": 1,
      "title": "Xác định phạm vi và rủi ro",
      "description": "Liệt kê các luồng xử lý tệp & object storage đang dùng, nguồn dữ liệu/thiết kế và mức độ rủi ro để chọn rule áp dụng."
    },
    {
      "step": 2,
      "title": "Triển khai và review",
      "description": "Ánh xạ từng rule với requirement, tài liệu kiến trúc, PR và người chịu trách nhiệm; review các cấu hình và failure path."
    },
    {
      "step": 3,
      "title": "Kiểm chứng và ghi nhận",
      "description": "Chạy test cho trường hợp chuẩn và tình huống sai như example_bad; lưu kết quả pass/fail theo mã rule, ghi lý do exception nếu có."
    }
  ],
  "common_issues": [
    {
      "issue": "Bỏ sót kiểm thử tình huống lỗi của xử lý tệp & object storage",
      "cause": "Chỉ kiểm thử luồng thành công, chưa đưa example_bad vào bộ regression.",
      "solution": "Tạo test case từ STD-BE-FILE#R001..R004, chạy cả negative case trước release."
    },
    {
      "issue": "Không có bằng chứng thực thi",
      "cause": "Checklist không liên kết với cấu hình hoặc kết quả đo thực tế.",
      "solution": "Đính kèm liên kết commit, test report, dashboard hoặc biên bản review theo mã rule."
    }
  ],
  "depends_on": [
    {
      "code": "STD-FILE-LIFECYCLE",
      "dependency_type": "aligns_with"
    }
  ],
  "diagrams": [],
  "applicability": {
    "scope": "conditional",
    "project_types": [
      "backend",
      "api",
      "web",
      "hybrid"
    ]
  },
  "dependency_policy": {
    "inheritance": "explicit_extends_only",
    "missing_required": "error",
    "conflict_resolution": "fail_on_duplicate_rule_ref"
  }
}
